{
  "fixtureSpecVersion": "1.0.0",
  "id": "two-instances-same-equipment",
  "patternId": "MP17",
  "mode": "planned",
  "action": "not-implemented",
  "input": {
    "equipment": "machine-a",
    "model": "Motor",
    "instances": [
      {
        "id": "Motor1",
        "member": "speed",
        "source": "D1000"
      },
      {
        "id": "Motor2",
        "member": "speed",
        "source": "D2000"
      }
    ]
  },
  "expect": {
    "bindings": 2,
    "duplicate": false
  }
}
