{
  "fixtureSpecVersion": "1.0.0",
  "id": "ascii-fixed-string",
  "patternId": "MP09",
  "mode": "planned",
  "action": "not-implemented",
  "input": {
    "bytesHex": "414243000000",
    "codec": "ASCII",
    "lengthBytes": 6,
    "termination": "null"
  },
  "expect": {
    "result": "ABC",
    "rawBytesPreserved": true
  }
}
