{
  "fixtureSpecVersion": "1.0.0",
  "id": "freshness-stale",
  "patternId": "MP16",
  "mode": "planned",
  "action": "not-implemented",
  "input": {
    "inputs": [
      {
        "value": "150",
        "quality": "good",
        "timeMs": 1000
      },
      {
        "value": "100",
        "quality": "good",
        "timeMs": 1500
      }
    ],
    "maxSkewMs": 100
  },
  "expect": {
    "quality": "bad",
    "error": "input-time-skew"
  }
}
