{
  "fixtureSpecVersion": "1.0.0",
  "id": "freshness-good",
  "patternId": "MP16",
  "mode": "planned",
  "action": "not-implemented",
  "input": {
    "inputs": [
      {
        "value": "150",
        "quality": "good",
        "timeMs": 1000
      },
      {
        "value": "100",
        "quality": "good",
        "timeMs": 1050
      }
    ],
    "maxSkewMs": 100
  },
  "expect": {
    "result": "50",
    "quality": "good"
  }
}
